{
  "id": "024_optional_dinov3_vith_probe",
  "title": "可选 DINOv3 ViT-H+ 探测",
  "goal": "在主路线不受影响且 24GB 显存允许时，尝试 DINOv3 ViT-H+ batch_size=1 特征缓存，判断其是否值得进入最终融合。",
  "inputs": [
    "src/cache_features_main.py",
    "outputs/main/folds/single_train.csv",
    "outputs/main/folds/single_val.csv",
    "outputs/main/folds/test_manifest.csv",
    "outputs/main/reports/single_model_error_analysis.json",
    "configs/main.yaml 中 optional_dinov3_vith 配置"
  ],
  "outputs": [
    "outputs/main/features/dinov3_vith_optional/single_train_features.pt 或失败说明",
    "outputs/main/features/dinov3_vith_optional/single_val_features.pt 或失败说明",
    "outputs/main/features/dinov3_vith_optional/test_features.pt 或失败说明",
    "outputs/main/reports/dinov3_vith_optional_probe.json"
  ],
  "execution_steps": [
    "确认主路线 015 或更后任务已有可用候选，不因该可选任务阻塞主线。",
    "尝试加载 DINOv3 ViT-H+ 官方 checkpoint，使用 fp16/bf16、eval、no_grad。",
    "从 batch_size=1 开始试跑 16-32 张样本，记录峰值显存和速度。",
    "如果 24GB 下稳定且速度可接受，缓存 single_train、single_val 和 test 特征。",
    "如果 OOM 或速度不可接受，立即停止并写失败报告。",
    "若缓存成功，复用 011 的 head 训练协议生成单模型指标，并决定是否加入后续融合。"
  ],
  "acceptance_criteria": [
    "该任务无论成功失败都不阻塞主路线。",
    "probe 报告明确记录显存、batch_size、速度、是否完整缓存和是否进入融合。",
    "若进入融合，必须通过同口径验证或 OOF 证明收益。",
    "失败时不做绕过 24GB 限制的强行加载。"
  ],
  "depends_on": [
    "004_feature_cache_framework",
    "012_single_model_error_analysis"
  ],
  "priority": "conditional",
  "resource_profile": {
    "gpu_memory_gb": "最高 24",
    "batch_size_hint": "只从 1 开始，稳定后最多 2",
    "runtime_notes": "条件任务，资源和时间充裕时再执行。"
  },
  "implementation_notes": [
    "该任务是探索上限，不是主路线。",
    "如果 ViT-H+ 只比 ViT-L 提升很小且成本巨大，不进入最终方案。",
    "不要为了该任务下载或运行 EVA-CLIP-18B。"
  ]
}
