{
  "id": "020_safe_pseudolabel_selection",
  "title": "安全伪标签选择",
  "goal": "使用最终融合/专家模型为测试集选择高置信伪标签，按类别限额和样本权重控制风险，为最终冲刺训练提供半监督数据。",
  "inputs": [
    "outputs/main/fusion/test_expert_gated_probs.npy",
    "outputs/main/fusion/test_calibrated_probs.npy",
    "outputs/main/folds/test_manifest.csv",
    "outputs/main/reports/expert_gate_metrics.json",
    "configs/main.yaml 中 pseudolabel 配置"
  ],
  "outputs": [
    "outputs/main/pseudolabels/pseudolabel_candidates.csv",
    "outputs/main/pseudolabels/pseudolabel_selected.csv",
    "outputs/main/reports/pseudolabel_selection_report.json"
  ],
  "execution_steps": [
    "选择当前 OOF 最优 test 概率源，优先 expert_gated，若专家未启用则使用 calibrated。",
    "计算每个测试样本的 predicted_label、confidence、margin、entropy。",
    "按类别设置基础置信阈值：头部类阈值更高，少数类阈值可稍低但样本权重更低。",
    "按类别设置 quota，防止 anger/awe/amusement 等头部预测吞掉伪标签集合。",
    "选择高置信且 margin 足够大的样本进入 pseudolabel_selected.csv，字段包含 filepath、filename、pseudo_label、label_id、confidence、sample_weight。",
    "对伪标签类别分布与训练集分布进行对比，若某类异常偏多，收紧该类阈值或 quota。",
    "输出 selection_report，记录每类选择数量、平均置信度、阈值和拒绝数量。"
  ],
  "acceptance_criteria": [
    "pseudolabel_selected.csv 中所有标签合法，测试文件顺序和 filepath 可追踪。",
    "每类伪标签数量受 quota 约束，不出现头部类别无节制扩张。",
    "伪标签 sample_weight 在 0.2-0.4 或配置约束范围内，不与真实标签等权。",
    "如果高置信样本太少或分布异常，报告建议跳过伪标签而不是强行使用。"
  ],
  "depends_on": [
    "019_expert_override_gate"
  ],
  "priority": "required",
  "resource_profile": {
    "gpu_memory_gb": "0",
    "batch_size_hint": "不涉及 GPU",
    "runtime_notes": "CPU 上处理概率和 CSV。"
  },
  "implementation_notes": [
    "伪标签只能在最终冲刺阶段使用，不能污染 OOF 主评估。",
    "少数类阈值放宽必须配合低 sample_weight。",
    "保留未使用伪标签的主模型作为回退候选。"
  ]
}
