{
  "id": "001_project_foundation",
  "title": "建立 main 路线工程底座",
  "goal": "创建可承载 24GB 多模型特征缓存、head 训练、OOF 融合和最终提交的统一目录、配置与实验记录规范。",
  "inputs": [
    "项目根目录 D:/daxue/深度学习/比赛",
    "AGENTS.md 中指定的 Conda 环境 dl",
    "dataset/train/train 和 dataset/test/test",
    "当前已有规划与历史分数记录"
  ],
  "outputs": [
    "src/ 或等价代码目录的 main 路线入口文件规划",
    "configs/main.yaml，记录模型池、路径、类别、显存策略和训练超参数",
    "outputs/main/ 目录结构：features、folds、heads、oof、fusion、reports、submissions",
    "outputs/main/reports/environment.json，记录 GPU、CUDA、PyTorch、transformers、timm、open_clip 等版本"
  ],
  "execution_steps": [
    "创建 outputs/main/features、outputs/main/folds、outputs/main/heads、outputs/main/oof、outputs/main/fusion、outputs/main/reports、outputs/main/submissions 目录。",
    "编写 configs/main.yaml，固定 8 个类别顺序为 amusement、anger、awe、contentment、disgust、excitement、fear、sadness。",
    "在配置中写入 24GB 显存策略：所有候选 backbone 默认 eval、torch.no_grad、fp16 或 bf16、冻结特征落盘。",
    "在配置中写入模型池：PE-Core-L14-336、DINOv3 ViT-L、InternViT-300M-448、EVA02-CLIP-L-336、DINOv3/ConvNeXt-L、已有 Cambrian/SigLIP2/OpenCLIP。",
    "实现或规划统一日志格式：每个实验输出 metrics.json、confusion_matrix.csv、class_report.json、prediction_probs.npy 和 manifest.json。",
    "运行环境探测命令并记录到 outputs/main/reports/environment.json。"
  ],
  "acceptance_criteria": [
    "所有 main 路线输出均位于 outputs/main 下，不覆盖已有规划产物。",
    "configs/main.yaml 包含类别顺序、模型池、路径、折数、随机种子、显存策略和提交格式约束。",
    "环境报告能明确显示当前使用 Conda 环境 dl。",
    "任何后续任务可仅依赖 configs/main.yaml 和 outputs/main 目录结构启动。"
  ],
  "depends_on": [],
  "priority": "required",
  "resource_profile": {
    "gpu_memory_gb": "0-1",
    "batch_size_hint": "不涉及训练",
    "runtime_notes": "主要是目录、配置和环境探测，可在 CPU 上完成。"
  },
  "implementation_notes": [
    "不要移动 dataset 或已有规划目录。",
    "配置文件中的类别顺序必须与 ImageFolder 字母序一致。",
    "所有 Python 命令使用 conda run -n dl python。"
  ]
}
