{
  "id": "021_retrain_with_pseudolabels",
  "title": "伪标签重训 heads 与融合",
  "goal": "在冻结特征不变的前提下，将高置信伪标签以低权重加入训练，重训 head 与融合，验证是否带来稳定收益。",
  "inputs": [
    "outputs/main/pseudolabels/pseudolabel_selected.csv",
    "outputs/main/features/<model_id>/all_train_features.pt",
    "outputs/main/features/<model_id>/test_features.pt",
    "outputs/main/oof/fold_feature_manifest.json",
    "outputs/main/reports/oof_candidate_models.json",
    "src/main_metrics.py"
  ],
  "outputs": [
    "outputs/main/pseudolabels/<model_id>_pseudo_heads/",
    "outputs/main/fusion/pseudo_test_probs.npy",
    "outputs/main/reports/pseudolabel_training_metrics.json",
    "outputs/main/reports/pseudolabel_vs_no_pseudo.json"
  ],
  "execution_steps": [
    "为每个 OOF 候选模型读取真实训练特征和测试特征中被选中的伪标签样本特征。",
    "构建伪标签训练集：真实样本权重为 1.0，伪标签样本权重使用 pseudolabel_selected.csv 中 sample_weight。",
    "每折重训 head 时，真实 val fold 不加入训练，伪标签样本可加入训练但不进入验证标签计算。",
    "训练同一 head 结构，生成 pseudo 版本 OOF 概率和 test 概率。",
    "用与 015 相同的融合流程融合 pseudo 版本概率。",
    "比较 pseudo 与 no-pseudo 的 OOF Macro-F1、每类 F1、fold 方差和少数类变化。",
    "如果 pseudo 版本 OOF 提升且少数类不恶化，标记为最终候选；否则回退 no-pseudo。"
  ],
  "acceptance_criteria": [
    "pseudolabel_vs_no_pseudo.json 明确说明伪标签是否保留。",
    "伪标签版本不得使用测试标签，只能使用模型高置信预测。",
    "如果 OOF Macro-F1 未提升或 fold 方差明显增大，最终不采用伪标签。",
    "pseudo_test_probs.npy 维度为 [1391, 8]，类别顺序固定。"
  ],
  "depends_on": [
    "020_safe_pseudolabel_selection"
  ],
  "priority": "required",
  "resource_profile": {
    "gpu_memory_gb": "1-4",
    "batch_size_hint": "head 训练 batch_size 64-512",
    "runtime_notes": "只重训 head，不重新提取 backbone 特征。"
  },
  "implementation_notes": [
    "伪标签训练必须保留 no-pseudo 回退。",
    "不要把伪标签样本加入 OOF 验证指标。",
    "伪标签通常小幅增益或负收益，决策必须由 OOF 支撑。"
  ]
}
