{
  "id": "016_tta_probability_generation",
  "title": "温和 TTA 概率生成",
  "goal": "对 OOF 融合中贡献最高的模型启用不破坏情绪语义的测试时增强，生成 TTA 版本概率并评估其对 Macro-F1 的收益。",
  "inputs": [
    "outputs/main/reports/fusion_ablation.json",
    "outputs/main/reports/oof_training_summary.json",
    "outputs/main/folds/*.csv",
    "outputs/main/folds/test_manifest.csv",
    "src/cache_features_main.py",
    "outputs/main/heads/<model_id>/fold_*_best.pt"
  ],
  "outputs": [
    "outputs/main/fusion/<model_id>_tta_test_probs.npy",
    "outputs/main/oof/<model_id>_tta_oof_probs.npy 或验证收益估计文件",
    "outputs/main/reports/tta_strategy_report.json",
    "outputs/main/fusion/test_tta_fused_probs.npy"
  ],
  "execution_steps": [
    "从 fusion_ablation 中选择 2-3 个贡献最高且特征提取成本可接受的模型，优先 PE-Core、DINOv3 ViT-L、InternViT-300M。",
    "定义温和 TTA 集合：原图中心裁剪、水平翻转、轻微 resize scale 0.95、轻微 resize scale 1.05。",
    "对每个入选模型按 TTA transform 重新提取 test 特征，或直接在图像推理阶段输出每个 TTA 的概率。",
    "对每个模型的 TTA 概率做平均，生成 model_id_tta_test_probs。",
    "若成本允许，对单 split val 或 OOF val 做相同 TTA，估计 TTA 对 Macro-F1 和少数类的收益。",
    "将 TTA test 概率和原始 test 概率按 OOF 估计收益进行融合，生成 test_tta_fused_probs。",
    "记录每个 TTA 变换的增益、耗时、显存和是否保留。"
  ],
  "acceptance_criteria": [
    "TTA 只包含不改变情绪语义的变换，不使用强随机裁剪、旋转、大幅颜色扰动。",
    "每个 TTA test 概率维度为 [1391, 8]，顺序与 test_manifest 一致。",
    "tta_strategy_report.json 明确保留哪些 TTA、拒绝哪些 TTA 以及原因。",
    "如果 TTA 在验证或 OOF 估计中没有提升，则最终融合回退到非 TTA 概率。"
  ],
  "depends_on": [
    "015_oof_probability_fusion"
  ],
  "priority": "required",
  "resource_profile": {
    "gpu_memory_gb": "4-24",
    "batch_size_hint": "沿用各模型缓存 batch_size；TTA 会增加 2-4 倍推理时间",
    "runtime_notes": "优先对贡献最高模型做 TTA，不对所有模型盲目重复。"
  },
  "implementation_notes": [
    "TTA 的价值通常是稳定小幅增益，不能牺牲测试顺序和概率校验。",
    "如果模型 head 是特征 head，TTA 可以通过重新缓存不同 transform 的 test 特征实现。",
    "不要在没有验证收益估计的情况下让 TTA 覆盖主融合。"
  ]
}
