{
  "id": "015_oof_probability_fusion",
  "title": "OOF 概率融合",
  "goal": "基于 5 折 OOF 概率学习多模型融合权重，形成主融合模型和 test 概率。",
  "inputs": [
    "outputs/main/oof/*_oof_probs.npy",
    "outputs/main/fusion/*_fold_test_probs.npy",
    "outputs/main/oof/*_oof_labels.npy",
    "outputs/main/reports/*_oof_metrics.json",
    "src/main_metrics.py"
  ],
  "outputs": [
    "outputs/main/fusion/fusion_weights.json",
    "outputs/main/fusion/oof_fused_probs.npy",
    "outputs/main/fusion/test_fused_probs.npy",
    "outputs/main/reports/fusion_metrics.json",
    "outputs/main/reports/fusion_ablation.json"
  ],
  "execution_steps": [
    "读取所有可用模型 OOF 概率，确认样本顺序和标签一致。",
    "建立 constrained weighted average 融合：权重非负且和为 1，用 OOF Macro-F1 网格或优化搜索。",
    "建立 per-class weighted average：每类单独搜索模型权重，但限制权重平滑，避免过拟合少数类。",
    "建立 logistic stacking：用 OOF 概率作为特征训练 multinomial logistic regression，使用交叉验证或强正则。",
    "对三种融合方法计算 OOF Macro-F1、每类 F1、混淆矩阵和过拟合风险。",
    "做模型 ablation：逐个移除模型，确认融合优于任一单模型，且移除弱模型不会提升。",
    "选择主融合方法，生成 test_fused_probs.npy 和 fusion_weights.json。"
  ],
  "acceptance_criteria": [
    "fusion_metrics.json 中主融合 OOF Macro-F1 高于参与融合的任一单模型；若没有高于，则回退到最佳单模型并记录原因。",
    "fusion_ablation.json 明确每个模型的增益或负贡献。",
    "test_fused_probs.npy 维度为 [1391, 8]，类别顺序固定。",
    "融合方法不得使用测试标签或线上反馈进行权重学习。"
  ],
  "depends_on": [
    "014_train_oof_heads"
  ],
  "priority": "required",
  "resource_profile": {
    "gpu_memory_gb": "0",
    "batch_size_hint": "不涉及训练 GPU",
    "runtime_notes": "CPU 上进行概率融合和小模型 stacking 即可。"
  },
  "implementation_notes": [
    "优先选择简单且 OOF 稳定的融合，不因复杂而默认使用 stacking。",
    "如果 per-class 权重让 OOF 提升但 fold 方差很大，应降级为全局权重。",
    "融合报告必须保留回退路径。"
  ]
}
