{
  "id": "018_tail_confusion_experts",
  "title": "训练少数类与易混淆专家",
  "goal": "为 disgust、contentment、excitement 等 Macro-F1 敏感类别训练小型专家模型，解决主模型在少数类和近邻情绪上的系统混淆。",
  "inputs": [
    "outputs/main/reports/tail_class_targets.json",
    "outputs/main/oof/*_oof_probs.npy",
    "outputs/main/features/<model_id>/all_train_features.pt",
    "outputs/main/folds/fold_0_train.csv 到 fold_4_val.csv",
    "outputs/main/reports/single_model_error_analysis.json"
  ],
  "outputs": [
    "outputs/main/experts/disgust_expert_oof_probs.npy",
    "outputs/main/experts/contentment_expert_oof_probs.npy",
    "outputs/main/experts/excitement_expert_oof_probs.npy",
    "outputs/main/experts/*_test_probs.npy",
    "outputs/main/reports/tail_expert_metrics.json",
    "outputs/main/reports/tail_expert_training_summary.json"
  ],
  "execution_steps": [
    "根据 tail_class_targets 确定专家集合：disgust vs anger/fear/sadness，contentment vs amusement，excitement vs amusement/awe。",
    "为每个专家构造训练样本，只包含目标类和混淆类；保留原始 filepath、label_id、fold 信息。",
    "专家输入优先使用主融合模型中贡献最高的 2-4 个特征拼接，或使用多模型 OOF 概率向量。",
    "按 5 折训练专家，输出每个专家的 OOF 概率和 test 概率。",
    "专家损失使用 class-weighted CE 或 focal loss，少数类权重按折内样本数计算。",
    "评估专家在对应子问题上的 F1、召回、误报率，以及对全局 Macro-F1 的潜在覆盖收益。",
    "记录每个专家的可用触发条件初稿，例如主模型 margin 小于阈值且专家少数类概率高于阈值。"
  ],
  "acceptance_criteria": [
    "每个专家都有 OOF 概率和 test 概率；若某专家不稳定，报告中标记不进入 override。",
    "tail_expert_metrics.json 包含专家子任务指标和映射回 8 类后的模拟收益。",
    "专家不能直接全局覆盖主模型，只作为 019_expert_override_gate 的候选输入。",
    "专家训练不使用测试标签或线上反馈。"
  ],
  "depends_on": [
    "014_train_oof_heads",
    "012_single_model_error_analysis"
  ],
  "priority": "required",
  "resource_profile": {
    "gpu_memory_gb": "1-4",
    "batch_size_hint": "专家 head batch_size 64-512",
    "runtime_notes": "专家只训练轻量模型，显存占用低。"
  },
  "implementation_notes": [
    "专家目标必须来自混淆分析，不要无依据增加专家。",
    "disgust 专家优先级最高，因为该类样本最少且 Macro-F1 敏感。",
    "若专家误报率高，应宁可不覆盖。"
  ]
}
