{
  "id": "023_final_submission_package",
  "title": "最终提交包生成",
  "goal": "根据最终概率源生成 test.txt、对照文件和提交校验报告，确保格式严格满足比赛要求。",
  "inputs": [
    "outputs/main/fusion/final_test_probs.npy",
    "outputs/main/folds/test_manifest.csv",
    "outputs/main/reports/final_model_decision.json",
    "src/main_submission.py",
    "configs/main.yaml 中类别列表"
  ],
  "outputs": [
    "outputs/main/submissions/test.txt",
    "outputs/main/submissions/test_with_filename.csv",
    "outputs/main/submissions/final_submission_manifest.json",
    "outputs/main/reports/final_submission_validation.json"
  ],
  "execution_steps": [
    "读取 final_test_probs.npy，按 argmax 或 final_model_decision 指定的决策方式生成 1391 个 label_id。",
    "按 test_manifest.csv 的 numeric_id 顺序映射 label_id 到英文标签。",
    "写 outputs/main/submissions/test.txt，每行一个标签，无文件名、无空行、无多余空格。",
    "写 test_with_filename.csv，包含 filename、pred_label、confidence、top2_label、margin，作为人工检查对照。",
    "运行 validate_submission，检查行数、标签合法性、编码、空行和顺序。",
    "生成 final_submission_manifest.json，记录最终模型、概率源、生成时间、类别顺序和校验结果。",
    "保留一个 backup_test.txt，对应次优候选，供线上分数异常时快速回退。"
  ],
  "acceptance_criteria": [
    "test.txt 恰好 1391 行。",
    "每行标签属于 8 个合法类别之一。",
    "第 1 行对应 1.jpg，第 1391 行对应 1391.jpg。",
    "final_submission_validation.json 显示所有校验通过。",
    "提交包中包含可追踪最终概率源和决策报告。"
  ],
  "depends_on": [
    "022_final_model_selection"
  ],
  "priority": "required",
  "resource_profile": {
    "gpu_memory_gb": "0",
    "batch_size_hint": "不涉及训练",
    "runtime_notes": "CPU 文件生成和校验。"
  },
  "implementation_notes": [
    "比赛要求纯标签 test.txt，不要把 filename 写入正式 test.txt。",
    "对照 CSV 只用于本地检查，不提交为正式文件，除非比赛另有要求。",
    "提交前再次打开文件确认没有 BOM 或多余空行。"
  ]
}
