{
  "id": "004_feature_cache_framework",
  "title": "统一冻结特征缓存框架",
  "goal": "实现可复用的特征缓存框架，支持不同 backbone、不同预处理、train/val/test/fold manifest 和 fp16 特征落盘。",
  "inputs": [
    "configs/main.yaml",
    "outputs/main/folds/*.csv",
    "outputs/main/folds/test_manifest.csv",
    "候选模型的 Hugging Face、timm 或 open_clip 加载方式"
  ],
  "outputs": [
    "src/cache_features_main.py 或等价入口",
    "src/backbone_adapters.py 或等价模型适配模块",
    "src/image_manifest_dataset.py 或等价 Dataset",
    "outputs/main/features/<model_id>/manifest_schema.json"
  ],
  "execution_steps": [
    "实现 ImageManifestDataset，从 CSV 读取 filepath、label、label_id 或 numeric_id，并在 __getitem__ 中统一 convert('RGB')。",
    "实现 BackboneAdapter 接口，包含 load_model、preprocess、extract_features、feature_dim、model_id。",
    "支持 transformers 模型、timm 模型和 open_clip/EVA 类模型的不同预处理。",
    "实现 cache_features(model_id, split_csv, output_path, batch_size, dtype)，在 eval/no_grad 下保存 features.npy 或 features.pt。",
    "为每个缓存输出保存 manifest.json，记录模型名、输入尺寸、dtype、feature_dim、样本顺序、CSV 来源和 batch_size。",
    "加入重复运行检查：已有缓存且 manifest 匹配时默认跳过，配置 force=true 时覆盖。",
    "用一个轻量模型或 dry run 跑 8 张样本，确认输出维度和 manifest 顺序正确。"
  ],
  "acceptance_criteria": [
    "特征缓存数量与输入 CSV 行数完全一致。",
    "train、val、test 和 fold 特征都复用同一框架。",
    "不同模型可以拥有不同 preprocess，不能共用错误归一化。",
    "manifest 中记录 feature_dim、dtype、input_size、model_name、source_csv 和 sample_ids。",
    "24GB 下默认启用 fp16 或 bf16 推理；OOM 时 batch_size 可降到 1。"
  ],
  "depends_on": [
    "002_data_split_and_audit",
    "003_metric_submission_contract"
  ],
  "priority": "required",
  "resource_profile": {
    "gpu_memory_gb": "1-24",
    "batch_size_hint": "框架 dry run 使用 1-8；具体模型由后续任务指定",
    "runtime_notes": "该任务主要实现框架，不要求完整缓存所有模型。"
  },
  "implementation_notes": [
    "大模型只做特征提取，不训练 backbone。",
    "特征可保存为 float16 以省磁盘，head 训练时再转 float32。",
    "对 ViT 模型优先使用 pooled/class token；如需要 patch pooling，必须在 manifest 中记录。"
  ]
}
