{
  "id": "008_cache_eva02_clip_features",
  "title": "缓存 EVA02-CLIP-L-14-336 特征",
  "goal": "缓存中型 EVA 系 CLIP 特征，作为 EVA-CLIP-18B 的 24GB 可行替代并提供 CLIP 语义互补。",
  "inputs": [
    "src/cache_features_main.py",
    "outputs/main/folds/single_train.csv",
    "outputs/main/folds/single_val.csv",
    "outputs/main/folds/test_manifest.csv",
    "configs/main.yaml 中 eva02_clip_l14_336 配置"
  ],
  "outputs": [
    "outputs/main/features/eva02_clip_l14_336/single_train_features.pt",
    "outputs/main/features/eva02_clip_l14_336/single_val_features.pt",
    "outputs/main/features/eva02_clip_l14_336/test_features.pt",
    "outputs/main/features/eva02_clip_l14_336/manifest.json",
    "outputs/main/reports/eva02_clip_l14_336_cache_report.json"
  ],
  "execution_steps": [
    "选择可在当前环境加载的 EVA02-CLIP-L-14-336 checkpoint，优先使用官方或可信实现。",
    "确认使用 EVA/OpenCLIP 对应 preprocess，不与 SigLIP2 或 DINOv3 混用。",
    "以 fp16、eval、no_grad 运行，batch_size 从 4 开始，稳定后尝试 8。",
    "缓存 single_train、single_val 和 test 特征。",
    "若模型有 image/text 双塔，只提取 image embedding，并保存归一化前或归一化后的约定。",
    "输出 cache_report，记录 checkpoint 来源、feature_dim、显存和预处理。"
  ],
  "acceptance_criteria": [
    "EVA02 特征数量与对应 CSV 行数一致。",
    "manifest 明确记录 checkpoint 名称和 preprocess 参数。",
    "特征无 NaN 且可用于单模型 head 训练。",
    "报告中明确说明未使用 EVA-CLIP-18B 的原因和 EVA02 的替代定位。"
  ],
  "depends_on": [
    "004_feature_cache_framework"
  ],
  "priority": "required",
  "resource_profile": {
    "gpu_memory_gb": "预计 10-22",
    "batch_size_hint": "先 4，稳定后 8，OOM 时 2",
    "runtime_notes": "若加载失败，保留失败报告并继续其他主力模型。"
  },
  "implementation_notes": [
    "EVA02 是主路线中的 EVA 互补，不做大模型微调。",
    "如果有多个 EVA02 权重可选，先选 336 输入版本。",
    "归一化后的 CLIP embedding 与未归一化 embedding 只能二选一，需在 manifest 中写清楚。"
  ]
}
